Title,Views,Duration
DSA In Java | Graph 01 | Java in One Shot | Graph in Java,456 views,5:00:22
250+ Refunds Claimed | GeeksforGeeks Three 90 Challenge!,566 views,0:50
Hack-4-Viksit Bharat Hackathon | Big Opportunity for Students | FoT DU x Google Cloud x SISL x GfG ,"5,562 views",37:29
DSA In Java | Backtracking | Java in One Shot | Backtracking in Java,"3,503 views",4:04:45
DSA In Java | Binary Search On Answer | Java in One Shot | Binary Search On Answer in Java,"3,092 views",1:58:52
How to Crack GATE Exam? | Topper’s Secret Strategy Revealed,871 views,33:40
DSA In Java | DP 03 | Java in One Shot | DP ( Dynamic Programming ) in Java,"3,386 views",4:54:52
Technical Scripter 2026 | How to Join & Win with GeeksforGeeks,"1,300 views",2:19
Future After B.Tech CSE | Top Career Options for CS Students,"14,058 views",11:27
Aggregate Functions in SQL for Beginners | Placement & Interviews,"1,079 views",5:00
DSA In Java | DP 02 | Java in One Shot | DP ( Dynamic Programming ) in Java,"4,477 views",5:07:42
NIMCET 2026 Crash Course Batch LAUNCH! 🔥 Complete Course in 90 DAYS,"1,055 views",20:44
Strongest TEAM of CS & DA in INDIA 🔥| Unstoppable TEAM United | Abdul Bari JOINED the GfG Revolution,"3,330 views",9:57
Complete Data Science Roadmap 2026 | How To Become a Data Scientist Step by Step,"1,817 views",10:54
HOW TO CRACK NIMCET ? Complete Roadmap for Beginners in 2026,"5,061 views",3:42
How Do I Win Three 90 Challenge? All Questions Answered | GeeksforGeeks,429 views,1:56
What Should You Do in B.Tech 1st & 2nd Year? | Complete Roadmap for Students | B.Tech Roadmap,"2,458 views",5:26
DSA In Java | DP 01 | Java in One Shot | DP ( Dynamic Programming ) in Java,"8,735 views",5:55:38
GATE 2026 | How to Score 55+ Marks with the Easiest CS Topics,"23,203 views",7:03
DSA In Java | Bit Manipulation | Java in One Shot | Bit Manipulation in Java,"6,042 views",4:33:52
Ready to take your money back? Introducing Three 90 Challenge by GeeksforGeeks!,"1,479 views",1:43
Complete the Course- Take Your Money Back | Three 90 Challenge by GeeksforGeeks,"5,272 views",1:21
DSA In Java | Hashmap 02 | Java in One Shot | Hashmap in Java,"3,836 views",3:24:34
GSOC 2026 Complete Roadmap for Beginners | Google Summer of Code Preparation Guide,"15,869 views",5:17
DSA In Java | Hashmap 01 | Java in One Shot | Hashmap in Java,"7,356 views",2:42:47
Synthetic Empathy Explained | Are Machines Replacing Human Connection?,791 views,6:13
Top AI Tools in 2025 | Complete AI Tier List Explained,"1,254 views",6:29
DSA In Java | Heap 02 | Java in One Shot | Heap in Java,"4,455 views",3:10:08
Free AIMT by GfG | All India Mock Test Details & Registration Process,"1,699 views",2:09
"MERN vs Data Science | Salary, Jobs & Future Scope Explained","3,904 views",19:14
